{"curves":{"collision_rate":[0.0,0.00423,0.007487,0.007243,0.006997,0.007243,0.00586,0.006677,0.007893,0.005533,0.006263,0.00594,0.007893,0.006757,0.006997,0.005697,0.00667,0.007243,0.00724,0.007483,0.006917,0.007567,0.007813,0.006347,0.007243,0.007077,0.00586,0.007077,0.00757,0.006757,0.00594,0.007813,0.006433,0.00708,0.00716,0.006673,0.006917,0.00537,0.008057,0.006753,0.007407,0.005613,0.006753,0.00781,0.007567,0.00643,0.007893,0.00594,0.005943,0.006837,0.006593,0.006917,0.00651,0.007083,0.00635,0.00773,0.006753,0.006187,0.00659,0.006267,0.006753,0.006757,0.00602,0.007893,0.00887,0.00659,0.006837,0.006837,0.006753,0.0057,0.006593,0.006833,0.006347,0.00773,0.007647,0.00635,0.007,0.006593,0.007487,0.00838,0.007483,0.008543,0.006103,0.007487,0.008303,0.006263,0.008217,0.0083,0.006187,0.00773,0.006673,0.006347,0.00651,0.007893,0.00716,0.00692,0.00659,0.00716,0.008297,0.006347,0.006997,0.007487,0.007,0.0057,0.00602,0.005613,0.007487,0.00651,0.006677,0.007407,0.007893,0.00659,0.00545,0.00708,0.006103,0.006757,0.006673,0.006837,0.006997,0.00773,0.005697,0.006837,0.007083],"dv_mean":[0.420647,0.48543,0.085413,0.077617,0.07771,0.07517,0.075453,0.076283,0.075533,0.073743,0.07239,0.070563,0.070173,0.070967,0.07069,0.070993,0.070713,0.070847,0.070363,0.069953,0.070727,0.07165,0.071657,0.0714,0.071753,0.07355,0.073077,0.072173,0.071517,0.07157,0.07228,0.073247,0.073103,0.073207,0.073933,0.073403,0.073013,0.074697,0.07642,0.075017,0.075677,0.07594,0.07886,0.078747,0.07812,0.080117,0.08291,0.084587,0.08742,0.085977,0.089373,0.091603,0.09831,0.096287,0.099097,0.101513,0.09999,0.10509,0.105533,0.108867,0.109737,0.110177,0.11157,0.111643,0.113117,0.114257,0.112307,0.111757,0.113807,0.111927,0.11197,0.113057,0.113493,0.112807,0.112473,0.11394,0.113783,0.112753,0.111397,0.112297,0.11201,0.11091,0.113453,0.111043,0.10951,0.112207,0.110053,0.112027,0.111083,0.109683,0.11169,0.10917,0.109423,0.110053,0.110477,0.110993,0.112077,0.112057,0.10911,0.112487,0.11027,0.109343,0.110477,0.112067,0.11137,0.109657,0.110687,0.110967,0.109323,0.10984,0.109153,0.11026,0.110053,0.111037,0.11027,0.110003,0.110647,0.110173,0.108217,0.109327,0.10858,0.109557,0.108977],"fairness_gap":[0.0,0.088227,0.017573,0.021307,0.022713,0.02125,0.02108,0.020937,0.020817,0.020273,0.019633,0.018843,0.018963,0.01909,0.018967,0.019073,0.019027,0.019103,0.018843,0.018797,0.01904,0.019217,0.01906,0.019307,0.019363,0.01975,0.019717,0.019183,0.019047,0.019227,0.0195,0.019857,0.019897,0.019673,0.019773,0.019883,0.01963,0.020447,0.020693,0.020423,0.020567,0.02069,0.02106,0.02165,0.021087,0.02173,0.022537,0.02281,0.023213,0.02309,0.0238,0.024433,0.02573,0.025143,0.02569,0.025793,0.025693,0.026707,0.026763,0.026813,0.0269,0.02686,0.026773,0.02688,0.0269,0.026943,0.026343,0.026313,0.026693,0.02665,0.02649,0.026697,0.02692,0.02692,0.026867,0.02648,0.026903,0.027143,0.026763,0.026837,0.026587,0.02636,0.027263,0.02629,0.02608,0.02647,0.026227,0.026497,0.026267,0.026013,0.026813,0.025813,0.026313,0.026237,0.026273,0.026337,0.026677,0.0263,0.026163,0.026773,0.026627,0.026187,0.026463,0.026517,0.026633,0.02638,0.026563,0.02626,0.026557,0.026583,0.02657,0.026857,0.026593,0.02649,0.0266,0.026623,0.026467,0.026557,0.026103,0.026527,0.02627,0.026613,0.02646],"timesteps":[98304.0,5071680.0,11914440.0,18721224.0,25535496.0,32352384.0,39168384.0,45984840.0,52799256.0,59628696.0,66445344.0,73273104.0,80086128.0,86903232.0,93713232.0,100526496.0,107337048.0,114156672.0,120986376.0,127813008.0,134616744.0,141456528.0,148271280.0,155096808.0,161935560.0,168764904.0,175573152.0,182400144.0,189217608.0,196023192.0,202842168.0,209646432.0,216465552.0,223285392.0,230100000.0,236938224.0,243745776.0,250577064.0,257401944.0,264236544.0,271056048.0,277867920.0,284693280.0,291517704.0,298340592.0,305169672.0,311987640.0,318783672.0,325586712.0,332398584.0,339202368.0,345999744.0,352825896.0,359646024.0,366461280.0,373302480.0,380132328.0,386945472.0,393766080.0,400591272.0,407406072.0,414212640.0,421021656.0,427837680.0,434668944.0,441488184.0,448293216.0,455097264.0,461900640.0,468725976.0,475543008.0,482355792.0,489177864.0,495994032.0,502807248.0,509618664.0,516453120.0,523268832.0,530074896.0,536906232.0,543738360.0,550545816.0,557341776.0,564168360.0,570978456.0,577782288.0,584585880.0,591428280.0,598248432.0,605076696.0,611879640.0,618706704.0,625519728.0,632335363.0,639144091.0,645962203.0,652805443.0,659633659.0,666460003.0,673287427.0,680115211.0,686928715.0,693740899.0,700569787.0,707397931.0,714202723.0,721022179.0,727842835.0,734659123.0,741483955.0,748303075.0,755130307.0,761938435.0,768758947.0,775575907.0,782388427.0,789200083.0,796013611.0,802832875.0,809651731.0,816464203.0,823299259.0,830124331.0]},"gate":"rules-only","plots":["img/plots/learning_curves.png","img/plots/baselines.png","img/plots/burn_timing.png","img/plots/yield_vs_ledger.png"],"strategies":[{"burden_gini":0.0,"collisions_pct":10.2,"dv_mean_ms":0.0,"escalation_pct":64.1,"manoeuvres_per_event":0.0,"name":"Do nothing"},{"burden_gini":0.0535,"collisions_pct":0.2,"dv_mean_ms":0.064,"escalation_pct":47.1,"manoeuvres_per_event":3.2,"name":"Both burn if Pc > 1e-4"},{"burden_gini":0.4786,"collisions_pct":1.3,"dv_mean_ms":0.03526,"escalation_pct":51.5,"manoeuvres_per_event":1.763,"name":"Lower ID yields"},{"burden_gini":0.3878,"collisions_pct":1.0,"dv_mean_ms":0.0414,"escalation_pct":50.3,"manoeuvres_per_event":2.07,"name":"Rules only (Who-Yields)"},{"burden_gini":0.5461,"collisions_pct":0.6,"dv_mean_ms":0.10692,"escalation_pct":55.4,"manoeuvres_per_event":3.582,"name":"Shared AI + rules shield"}]}